{
    "measurementType": "MIDS-0 Object Count",
    "measurementValue": 500,
    "measurementAccuracy": "Estimate",
    "measurementMethod": "DiSSCo MIDS level",
    "measurementDerivation": "Reported",
    "hasReference":
    [
        {
            "referenceType": "Measurement methodology",
            "resourceURI": "https://doi.org/10.5281/zenodo.3465285",
            "referenceDetails": "Saarenmaa, Hannu, Agosti, Donat, Dillen, Mathias, Egloff, Willi, Gagnier, Pierre-Yves, Groom, Quentin, Hardisty, Alex, & Raes, Niels. (2019). Open access implementation guidelines for DiSSCo. Deliverable D6.5 (pp. 1â€“35).",
            "referenceText": "Open access implementation guidelines for DiSSCo. Deliverable D6.5",
            "hasIdentifier":
            [
                {
                    "identifierType": "DOI",
                    "identifier": "10.5281/zenodo.3465285"
                }
            ]
        }
    ]
}